A1: Roll | B1: Name | C1: Bangla | D1: English | E1: Math | F1: Total
A2: 1 | B2: Saad | C2: 45 | D2: 45 | E2: 45 | F2: =SUM(C2:E2) -> 135
A3: 2 | B3: Sabbir | C3: 66 | D3: 66 | E3: 66 | F3: =SUM(C3:E3) -> 198
A4: 3 | B4: Razia | C4: 33 | D4: 44 | E4: 66 | F4: =SUM(C4:E4) -> 143
A5: 4 | B5: Tonu | C5: 64 | D5: 64 | E5: 46 | F5: =SUM(C5:E5) -> 174
A6: 5 | B6: Raisa | C6: 46 | D6: 65 | E6: 45 | F6: =SUM(C6:E6) -> 156